{
  "artifact_id": "extract-001",
  "request_id": "intake-001",
  "source_ref": "src-001",
  "state": "partial_success",
  "syntax_boundary": "syntax_only",
  "semantic_boundary_enforced": true,
  "provenance": {
    "source_hash": "sha256:abc123",
    "extractor_version": "phase1.0",
    "source_modified_at": "2026-03-19T09:59:00Z",
    "byte_count": 4096
  },
  "completeness": {
    "status": "incomplete",
    "operator_visible_summary": "Section capture succeeded, but one table could not be normalized."
  },
  "structures": {
    "sections": [
      {
        "section_id": "sec-1",
        "heading": "Introduction",
        "level": 1,
        "block_count": 3
      }
    ],
    "tables_detected": 1,
    "metadata_fields": {
      "title": "Chapter 1"
    },
    "content_blocks": [
      {
        "block_id": "blk-1",
        "block_kind": "heading",
        "text": "Introduction"
      },
      {
        "block_id": "blk-2",
        "block_kind": "paragraph",
        "text": "This is the opening section."
      }
    ]
  },
  "extracted_at": "2026-03-19T10:01:00Z"
}
